{
  "event_id": "uuid",
  "event_type": "payment.success",
  "schema_version": 1,
  "idempotency_key": "agent-skill-nonce",
  "tx_id": "pay_xxx",
  "agent_did": "did:solana:agent123",
  "skill_did": "did:solana:skill456",
  "amount_minor": 5000000,
  "currency": "USDC",
  "tx_hash": "solana_tx_hash",
  "status": "COMPLETED",
  "occurred_at": "2026-02-27T12:00:05Z",
  "confirmed_at": "2026-02-27T12:00:05Z",
  "request_id": "req_example",
  "trace_id": "trace_example"
}

